{
  "$schema": "../activity.schema.json",
  "id": "department-camping-night",
  "status": "published",
  "title": "系露營：一起籌辦，留下大一的共同回憶",
  "date": "2026-10-18",
  "categoryId": "department-camping",
  "summary": "從活動設計、道具製作到小隊帶領，和夥伴一起籌辦營隊，在系出遊中認識彼此。",
  "details": "系露營是電機系每年一次的大型系出遊，由大一新生一起籌辦。活動組、場美組與美公組分工合作，邀請學長姐參與，在準備與遊戲互動中累積默契與回憶。",
  "location": "校外活動場地",
  "detail": {
    "eyebrow": "EE CAMPING · GROW TOGETHER",
    "intro": [
      "系露營是電機系每年一次的大型系出遊，也是大一新生第一次一起籌辦營隊的機會。對新生而言，是和朋友從零開始打造活動的體驗；對學長姐來說，則是團聚、認識新生與盡情玩樂的好時光。",
      "從籌備會議、流程安排到正式活動，大家在分工合作中交流想法、發掘自己的潛能，也找到志同道合的夥伴。一起想點子、解決問題、互相扶持，讓原本陌生的同學逐漸成為有默契的朋友。",
      "營隊期間，新生帶領學長姐參與遊戲與互動，也能透過交流認識不同的大學生活與未來方向。系露營讓大家在共同努力的過程中成長，留下屬於大一的難忘回憶。"
    ],
    "heroImages": [
      { "src": "/activities/department-camping/intro-01.webp", "alt": "系露營參與者在操場旁的團體合照" },
      { "src": "/activities/department-camping/intro-02.webp", "alt": "系露營參與者在地墊與活動道具旁互動" }
    ],
    "sections": [],
    "tabs": [
      {
        "id": "groups",
        "navLabel": "各組介紹",
        "sections": [
          {
            "id": "activity",
            "navLabel": "活動組",
            "eyebrow": "ACTIVITIES · IMAGINE & HOST",
            "title": "活動組",
            "paragraphs": [
              "活動組負責營隊中的活動設計與現場帶領，並擔任各個關卡的關主，把有趣的點子變成大家能一起投入的遊戲。",
              "從發想玩法到掌握現場氣氛，活動組用創意與各自的拿手本領，讓參與者玩得開心，也在互動中拉近彼此的距離。"
            ],
            "image": { "src": "/activities/department-camping/group-activity.webp", "alt": "系露營參與者在草地上圍成一圈進行團體活動" }
          },
          {
            "id": "scenography",
            "navLabel": "場美組",
            "eyebrow": "SCENOGRAPHY · DESIGN & MAKE",
            "title": "場美組",
            "paragraphs": [
              "場美組負責活動與戲劇所需的道具製作，將活動構想化成看得見、用得到的作品，讓每個環節更有畫面與氣氛。",
              "從紙板到各式材料，場美組以創意和手作把想像一步步實現。一起設計、製作與完成道具，也是留下團隊成果的過程。"
            ],
            "image": { "src": "/activities/department-camping/group-scenography.webp", "alt": "系露營場美組成員在建築入口前合照" }
          },
          {
            "id": "public-relations",
            "navLabel": "美公組",
            "eyebrow": "PUBLIC RELATIONS · CONNECT & CARE",
            "title": "美公組",
            "paragraphs": [
              "美公組，也就是美麗公關組，負責帶領小隊、照顧小隊員的生活需求，協助大家跟上活動節奏，讓每位參與者都能安心投入營隊。",
              "從食衣住行到遊戲互動，美公組以細心與陪伴照顧小隊大小事，活絡相處氣氛，成為小隊員在營隊中感到安心的夥伴。"
            ],
            "image": { "src": "/activities/department-camping/group-public-relations.webp", "alt": "系露營美公組成員在操場欄杆旁合照" }
          }
        ]
      }
    ]
  }
}
